award_id,cancelled_trump,title,directorate,start_date,year,state,org_name,end_date,award_amount
"=""2329392""",no,Conference: Summer Geometry Initiative,DMS,07/01/2023,2023,MA,Massachusetts Institute of Technology,12/31/2023,50000.0
"=""2246186""",no,CRII: SHF: RUI: Leroid: Bug Oracle and Environment Configuration Automation for Android Bug Report Reproduction,CCF,07/01/2023,2023,MO,University of Central Missouri,10/31/2023,175000.0
"=""2238847""",no,CAREER: Interpretable Provenance Analysis for Heterogeneous Systems at Scale,CNS,07/01/2023,2023,NJ,Rutgers University New Brunswick,09/30/2023,83594.0
"=""2242369""",no,DDRIE: Farm to Fridge: Traceability and Quality Incentivizing in a Dairy Chain,SES,07/01/2023,2023,CA,University of California-Santa Cruz,12/31/2023,25000.0
"=""2326439""",no,Travel: New Statistical Physics of Living Matter: non-equilibrium states under adaptive control,DMR,07/01/2023,2023,TX,William Marsh Rice University,12/31/2023,30000.0
"=""2327585""",no,WORKSHOP: Doctoral Consortium at ACM DIS 2023,IIS,07/01/2023,2023,PA,Carnegie Mellon University,12/31/2023,20000.0
"=""2232653""",no,Collaborative Research: SaTC: CORE: Small: Supporting Privacy Negotiation Among Multiple Stakeholders in Smart Environments,CNS,07/01/2023,2023,MD,University of Maryland Baltimore County,11/30/2023,163132.0
"=""2305856""",no,NSF PRFB FY 2023: Investigating proximate mechanisms and ultimate drivers of temperature-dependent development of male:female ratios in reptiles,DBI,07/01/2023,2023,IL,"Breitenbach, Anthony",09/30/2023,30000.0
"=""2301349""",no,ERI: Reaction Mechanisms Against Cyberattacks Designed to Result in Voltage Collapse in Smart Power Distribution Systems: Modeling and Experimental Validation Frameworks,ECCS,07/01/2023,2023,IL,Southern Illinois University at Carbondale,11/30/2023,199542.0
"=""2244879""",no,FRG: Collaborative Research: Singularities in Incompressible Flows: Computer Assisted Proofs and Physics-Informed Neural Networks,DMS,07/01/2023,2023,MD,"University of Maryland, College Park",12/31/2023,138009.0
"=""2238128""",no,"CAREER: Advances in Randomization Inference for Causal Effects: Heterogeneity, Sensitivity, and Complexity",DMS,07/01/2023,2023,IL,University of Illinois at Urbana-Champaign,11/30/2023,84609.0
"=""2309931""",no,"Travel Support for 16th Tri-Annual International Conference on Stochastic Programming (ICSP); Davis, California; 24-28 July 2023",CMMI,06/15/2023,2023,CA,University of California-Davis,08/31/2023,24000.0
"=""2246411""",no,"2023 Water Disinfection, Byproducts, and Health: Challenges of Disinfection and Oxidation Processes to Provide Safe Drinking Water in a Changing World",CBET,06/15/2023,2023,RI,Gordon Research Conferences,09/30/2023,10030.0
"=""2306957""",no,"Collaborative Research: RUI: Uncovering eusocial pathways and consequences: Phylogenomics, morphological, and molecular evolution in Synalpheus snapping shrimps.",DEB,06/15/2023,2023,NY,SUNY College at Old Westbury,10/31/2023,506686.0
"=""2326925""",no,Student Travel Support for the 49th International Conference on Very Large Databases 2023,IIS,06/15/2023,2023,IL,University of Illinois at Chicago,11/30/2023,25000.0
"=""2324896""",no,"Conference: 2023 Archaea: Ecology, Metabolism and Molecular Biology GRC and GRS The Root and Branch of Discovery: Lessons on Life from the Archaea",MCB,06/15/2023,2023,RI,Gordon Research Conferences,11/30/2023,20000.0
"=""2331765""",no,"I-Corps: Flat-packed, reconfigurable panelized modular housing",TI,06/15/2023,2023,CO,Colorado School of Mines,11/30/2023,50000.0
"=""2328517""",no,Conference: NAIRR: Strengthening & Democratizing The U.S. AI Innovation Ecosystem Summit,OAC,06/01/2023,2023,DC,SEEDAI INC,11/30/2023,98159.0
"=""2333913""",no,COLLABORATIVE RESEARCH: Quantifying the effects of variable light and iron on the nitrate assimilation isotope effect of phytoplankton,OCE,06/01/2023,2023,FL,University of South Florida,07/31/2023,1259.0
"=""2224422""",no,Collaborative Research: Research: An exploration of how faculty mentoring influences doctoral student psychological safety and the impact on work-related outcomes,EEC,06/01/2023,2023,IL,University of Illinois at Urbana-Champaign,06/30/2023,152219.0
"=""2327269""",no,Collaborative Research: Conference: NSF/TIH PI Meeting and Workshop for Indo-US Research Collaboration,CNS,06/01/2023,2023,IN,Purdue University,11/30/2023,62467.0
"=""2325516""",no,2023 Nanoporous Materials and Their Applications Gordon Research Conference and Gordon Research Seminar,DMR,06/01/2023,2023,RI,Gordon Research Conferences,11/30/2023,10000.0
"=""2327172""",no,Conference: Student and Junior Faculty Support for the International Symposium on Sustainable Systems and Technology (ISSST),CBET,06/01/2023,2023,PA,Pennsylvania State Univ University Park,11/30/2023,19998.0
"=""2330074""",no,I-Corps: Advancing access equity and user safety through bio-inspired all-terrain mobility solutions,TI,06/01/2023,2023,OH,University of Akron,11/30/2023,50000.0
"=""2327270""",no,Collaborative Research: Conference: NSF/TIH PI Meeting and Workshop for Indo-US Research Collaboration,CNS,06/01/2023,2023,MD,University of Maryland Baltimore County,11/30/2023,15852.0
"=""2323994""",no,Conference: AGU Chapman Conference on Hydrothermal Circulation and Seawater Chemistry,EAR,06/01/2023,2023,DC,American Geophysical Union,11/30/2023,50000.0
"=""2246703""",no,"Combinatorics of Filters, Large Cardinal and Prikry-Type Forcing",DMS,06/01/2023,2023,IL,University of Illinois at Chicago,10/31/2023,150000.0
"=""2238972""",no,CAREER: Understanding and Harnessing Host-derived Small RNAs Against Opportunistic Pathogens,CBET,06/01/2023,2023,MA,Northeastern University,08/31/2023,499872.0
"=""2235833""",no,Fostering More Accurate and Identity-Affirming Science Teaching and Learning at Hispanic-Serving Institutions,DUE,06/01/2023,2023,FL,Florida International University,10/31/2023,204441.0
"=""2246632""",no,Measure Transportation And Notions Of Dimensionality In High Dimensional Probability,DMS,06/01/2023,2023,MA,Massachusetts Institute of Technology,06/30/2023,137778.0
"=""2227496""",no,BRITE Pivot: Quantum Computing and Machine Learning for Fluid-Structure Interaction Problems,CMMI,06/01/2023,2023,TX,Texas A&M University,06/30/2023,530513.0
"=""2329736""",no,I-Corps: Full Arch Device for a Comprehensive Dental Hygiene Routine,TI,06/01/2023,2023,MD,University of Maryland at Baltimore,11/30/2023,50000.0
"=""2239755""",no,CAREER: CAS-Climate: Sustainable Design Principles for Emerging Photovoltaics,CBET,06/01/2023,2023,SD,South Dakota School of Mines and Technology,11/30/2023,158158.0
"=""2326807""",no,2023 Crystal Growth and Assembly Gordon Research Conference and Gordon Research Seminar,DMR,06/01/2023,2023,RI,Gordon Research Conferences,11/30/2023,10000.0
"=""2212788""",no,SBIR Phase I:  Lightweight Scalable Auctions for Decentralized Martketplaces and Beyond,TI,05/15/2023,2023,NY,"LIGERO, INC.",12/31/2023,0.0
"=""2318109""",no,Conference: Network and Distributed System Security Symposium (NDSS) 2023,CNS,05/15/2023,2023,VA,Internet Society,10/31/2023,20000.0
"=""2319663""",no,Collaborative Research: DOE/NSF Workshop on Correctness in Scientific Computing,CCF,05/01/2023,2023,CA,University of California-Davis,12/31/2023,15000.0
"=""2222097""",no,Collaborative Research: Planning for Uncertainty in Coupled Water-Power Distribution Networks,CMMI,05/01/2023,2023,IN,University of Notre Dame,08/31/2023,200000.0
"=""2318858""",no,Conference: NSF Industry Partnership Summit: A Workshop Proposal,TF,05/01/2023,2023,SC,University Industry Demonstration Partnership,10/31/2023,88869.0
"=""2321547""",no,I-Corps: Non-invasive intracranial pressure sensing,TI,05/01/2023,2023,PA,Carnegie Mellon University,10/31/2023,50000.0
"=""2315410""",no,Conference: IEEE ICHI 2023 Doctoral Consortium Program,IIS,05/01/2023,2023,SC,University of South Carolina at Columbia,11/30/2023,20000.0
"=""2236011""",no,Transforming Introductory Computer Science Instruction with an AI-Driven Classroom Assistant,DUE,05/01/2023,2023,CA,University of California-Santa Cruz,07/31/2023,191929.0
"=""2316830""",no,"Conference: Gordon Research Conference on Biomechanics in Vascular Biology and Disease; South Hadley, Massachusetts; 6-11 August 2023",CMMI,05/01/2023,2023,RI,Gordon Research Conferences,08/31/2023,10200.0
"=""2319661""",no,Collaborative Research: DOE/NSF Workshop on Correctness in Scientific Computing,CCF,05/01/2023,2023,NJ,Rutgers University New Brunswick,12/31/2023,19991.0
"=""2319662""",no,Collaborative Research: DOE/NSF Workshop on Correctness in Scientific Computing,CCF,05/01/2023,2023,DE,University of Delaware,12/31/2023,15000.0
"=""2321498""",no,"Conference: 2023 Enzymes, Coenzymes and Metabolic Pathways Gordon Research Seminar: Enzyme Function and Mechanism in Biology and Beyond",MCB,05/01/2023,2023,RI,Gordon Research Conferences,10/31/2023,5000.0
"=""2302699""",no,Lattice Reduction in Cryptography and Number Theory,DMS,05/01/2023,2023,CA,University of California-Davis,08/31/2023,232692.0
"=""2304069""",no,SBIR Phase I:  Automated One-Hour Testing for Bacteremia and Antibiotic Sensitivity,TI,05/01/2023,2023,MD,ASTEK DIAGNOSTICS LLC,12/31/2023,294587.0
"=""2318371""",no,"The 9th Midwest Workshop on Control and Game Theory, April 22-23, 2023",ECCS,04/15/2023,2023,MN,University of Minnesota-Twin Cities,09/30/2023,17500.0
"=""2232553""",no,Collaborative Research: CCRI: New: A Research News Recommender Infrastructure with Live Users for Algorithm and Interface Experimentation,IIS,04/15/2023,2023,ID,Boise State University,12/31/2023,150000.0
"=""2235069""",no,Collaborative Research: CCRI: Grand: Virtual Experience Research Accelerator (VERA),CNS,04/15/2023,2023,PA,Lehigh University,11/30/2023,27457.0
"=""2246464""",no,Travel: Doctoral Consortium at the 22nd International Conference on Autonomous Agents and Multiagent Systems,IIS,04/15/2023,2023,NY,Syracuse University,07/31/2023,25000.0
"=""2317863""",no,Travel: NSF Student Travel Grant for the 2023 Empirical Software Engineering International Week (ESEIW),CCF,04/15/2023,2023,NC,University of North Carolina at Wilmington,11/30/2023,20000.0
"=""2212675""",no,SBIR Phase I:  Super High Performance No-Code Platform,TI,04/15/2023,2023,NY,"4thought Technologies, Inc.",09/30/2023,256000.0
"=""2240835""",no,A Historical Study of Plant-Based Healing in the Age of Biomedicine,SES,04/01/2023,2023,PA,University of Pennsylvania,09/30/2023,15032.0
"=""2315484""",no,Building Upon the EarthCube Community. A Geoscience and Cyberinfrastructure Workshop,RISE,04/01/2023,2023,CA,University of Southern California,09/30/2023,67048.0
"=""2236459""",no,CAREER: Neuro-navigation guided non-invasive brain stimulation for individualized precision rehabilitation in stroke,CBET,04/01/2023,2023,OK,University of Oklahoma Norman Campus,11/30/2023,175176.0
"=""2317628""",no,Conference: 20th International Meeting for the Cell and Molecular Biology of Chlamydomonas,MCB,04/01/2023,2023,NJ,Princeton University,09/30/2023,15000.0
"=""2310166""",no,Conference: Student Travel Grant Request for IEEE International Symposium on Performance Analysis of Systems and Software,CCF,04/01/2023,2023,KS,University of Kansas Center for Research Inc,09/30/2023,15000.0
"=""2241947""",no,Doctoral Dissertation Research: Implications of Diverse Environmental Knowledge for Community Conservation,BCS,04/01/2023,2023,GA,University of Georgia,12/31/2023,12275.0
"=""2317347""",no,Conference: Interior of the Earth Gordon Research Conference and Seminar,EAR,04/01/2023,2023,RI,Gordon Research Conferences,09/30/2023,49800.0
"=""2327178""",no,Collaborative Research: Neurocognitive Experimentation to Enhance STEM Education: Studies on Divergent Thinking in Female and Male Engineering Students,DUE,04/01/2023,2023,OH,University of Dayton,09/30/2023,84457.0
"=""2308960""",no,Conference: Power and Energy Conference at Illinois 2023 (PECI),ECCS,04/01/2023,2023,IL,University of Illinois at Urbana-Champaign,09/30/2023,20000.0
"=""2240875""",no,"Doctoral Dissertation Research: Rivers of Milk: Dairy Science, Environment, and Technopolitics of Food Infrastructures",SES,04/01/2023,2023,PA,University of Pennsylvania,09/30/2023,15750.0
"=""2243796""",no,Workshop: Building Research Capacity in Engineering Education Through a RIEF Virtual Community of Practice,EEC,04/01/2023,2023,OH,"OHIO STATE UNIVERSITY, THE",12/31/2023,173358.0
"=""2301677""",no,Collaborative Research: Burrows as buffers: do microhabitat selection and behavior mediate desert tortoise resilience to climate change?,DEB,04/01/2023,2023,IA,Iowa State University,11/30/2023,326361.0
"=""2213202""",no,SBIR Phase I:  Adaptive Dialog Systems As Second Language Learning Partners,TI,03/15/2023,2023,NY,Articulate.AI Inc.,11/30/2023,256000.0
"=""2318724""",no,EAGER: SHF: Verified Audit Layers for Safe Machine Learning,CCF,03/15/2023,2023,NY,New York University,11/30/2023,21650.0
"=""2316758""",no,Conference: Workshop: 2023 Conference on Computer Supported Cooperative Work & Social Computing,IIS,03/15/2023,2023,MI,Michigan State University,12/31/2023,19956.0
"=""2302151""",no,I-Corps: System for rapid detection of virus-loaded aerosol,TI,03/15/2023,2023,MA,Massachusetts Institute of Technology,08/31/2023,50000.0
"=""2213107""",no,SBIR Phase I:  Dual-Modality Tomography Core Scanner for Oil Saturation Estimation at the Wellsite (iTomoSoS),TI,03/15/2023,2023,TX,ITOMOGRAPHY CORPORATION,11/30/2023,256000.0
"=""2316129""",no,Travel: Supporting Students and Early Career Scientists in Quaternary Research: the 2023 USNC/INQUA Congress Travel Fellowship Program,EAR,03/15/2023,2023,DC,National Academy of Sciences,11/30/2023,30000.0
"=""2309562""",no,"Conference: Groups of dynamical origin, automata and spectra",DMS,03/01/2023,2023,FL,University of South Florida,12/31/2023,20700.0
"=""2239472""",no,CAREER: Nonlinear Infrared Studies of Biomolecular Coacervation,CHE,03/01/2023,2023,IN,University of Notre Dame,08/31/2023,76623.0
"=""2238516""",no,CAREER: Advancing Atomic-Level Understanding of Kinetically Driven Solid-Solid Phase Transitions from First Principles and Machine Learning,DMR,03/01/2023,2023,ME,University of Maine,08/31/2023,17849.0
"=""2310269""",no,The Polymer Physics of Separation Membranes (A DPOLY Short Course at the 2023 American Physical Society March Meeting),CBET,03/01/2023,2023,PA,Pennsylvania State Univ University Park,08/31/2023,8000.0
"=""2317140""",no,Travel: CECAM Flagship Workshop,CBET,03/01/2023,2023,IL,Northwestern University,08/31/2023,5000.0
"=""2234760""",no,Doctoral Dissertation Research: The role of input reliability and shared variability on the acquisition of linguistic variation,BCS,03/01/2023,2023,PA,University of Pennsylvania,10/31/2023,10872.0
"=""2244772""",no,Conference: 2023 Movement Ecology of Animals Gordon Research Conference and Seminar: Proximate and Ultimate Drivers of Animal Movement,DEB,03/01/2023,2023,RI,Gordon Research Conferences,08/31/2023,20000.0
"=""2223166""",no,SBIR Phase I:  Extremely Low Frequency Characterization of High-Risk Lightning,TI,03/01/2023,2023,FL,HELIOS POMPANO INC,09/30/2023,270109.0
"=""2244289""",no,"Conference: Coordination, Evaluation, and Support for Astronomy REU Sites (CEASARS)",AST,03/01/2023,2023,NJ,Rutgers University New Brunswick,11/30/2023,90123.0
"=""2212930""",no,SBIR Phase I:  Robotic system outputting natural tactile-sign language to aid Deaf and Deafblind communication,TI,02/15/2023,2023,MA,TATUM ROBOTICS LLC,10/31/2023,255975.0
"=""2235051""",no,Collaborative Research: NSFGEO-NERC: Understanding surface-to-bed meltwater pathways across the Greenland Ice Sheet using machine-learning and physics-based models,OPP,02/15/2023,2023,NJ,Princeton University,12/31/2023,411096.0
"=""2151713""",no,SBIR Phase I:  High-throughput Nanocatalyst Synthesis and Screening for Broad Decarbonization ,TI,02/15/2023,2023,IL,MATTIQ INC,10/31/2023,255904.0
"=""2315721""",no,Conference: Workshop/Exploring National Infrastructure for Public Access Usage and Impact Reporting,OAC,02/15/2023,2023,MI,Regents of the University of Michigan - Ann Arbor,12/31/2023,49945.0
"=""2223164""",no,SBIR Phase I:  Scaling Up Open Innovation with Crowd Wisdom and Artificial Intelligence (AI) for Smarter and More Sustainable Fashion,TI,02/15/2023,2023,OH,"ILAMBDA, INC.",11/30/2023,274667.0
"=""2208754""",no,SBIR Phase I:  Cosmic Ray Neutron Sensing for Soil Water Measurements at Irrigation Decision Resolution,TI,02/15/2023,2023,MA,Silverside Detectors Inc.,10/31/2023,255663.0
"=""2314055""",no,I-Corps: Increasing surgical sensitivity,TI,02/15/2023,2023,NY,Icahn School of Medicine at Mount Sinai,07/31/2023,50000.0
"=""2236739""",no,CAREER: Equity Focused Elementary Mathematics:  Creating Virtual Mathematics Communities in Rural Georgia,DRL,02/15/2023,2023,GA,Mercer University,07/31/2023,346897.0
"=""2317300""",no,Travel: NSF Student Travel Grant for 2023 IEEE Conference on Secure and Trustworthy Machine Learning (IEEE SaTML),CNS,02/01/2023,2023,WI,University of Wisconsin-Madison,12/31/2023,15000.0
"=""2237784""",no,CAREER: CAS: Copolymerization of Vinyl Monomers with Isocyanides for Degradable Polymers,CHE,02/01/2023,2023,NY,Cornell University,09/30/2023,293797.0
"=""2304715""",no,2023 Bacterial Cell Biology and Development GRC,MCB,02/01/2023,2023,RI,Gordon Research Conferences,07/31/2023,22500.0
"=""2317969""",no,The Inquiry-Based Learning Regional Communities Project,DUE,02/01/2023,2023,ID,Idaho State University,09/30/2023,98926.0
"=""2237046""",no,CAREER: Unraveling the Developmental Processes Underlying the Twining Motion of Vines,IOS,02/01/2023,2023,NY,Cornell University,11/30/2023,750000.0
"=""2246034""",no,"2023 Complex Active and Adaptive Materials Systems: Optimizing the Synergy Between Architecture, Non-Equilibrium Processes and Materials",DMR,02/01/2023,2023,RI,Gordon Research Conferences,07/31/2023,20000.0
"=""2239284""",no,CAREER: High-Performance Ferroelectric Memory for In-Memory Computing,ECCS,02/01/2023,2023,NY,Rochester Institute of Tech,12/31/2023,436730.0
"=""2312225""",no,Travel: 2023 International Microwave Symposium Educational Initiatives for Project Connect,ECCS,02/01/2023,2023,OR,Oregon State University,10/31/2023,25000.0
"=""2318137""",no,SCC-CIVIC-FA Track B: Inclusive Insurance: Improving the Post-Flood Financial Resiliency of Low- and Moderate-Income Households,CNS,02/01/2023,2023,NY,Environmental Defense Fund,09/30/2023,79683.0
"=""2239228""",no,CAREER: AF: Fast Algorithms for Riemannian Optimization,CCF,02/01/2023,2023,TX,Texas Tech University,12/31/2023,207828.0
"=""2241620""",no,Doctoral Dissertation Research: Financial and Legal Planning of Elders,BCS,01/15/2023,2023,CA,University of California-Irvine,12/31/2023,17111.0
"=""2308412""",no,Travel: Student Travel Grant for the 2023 ACM SIGMETRICS International Conference on Measurement and Modeling of Computer Systems,CNS,01/15/2023,2023,PA,Carnegie Mellon University,12/31/2023,25000.0
"=""2233430""",no,Conference: Scientific Collaboration Network Evaluation and Strategy Using Graph Analysis,OISE,01/15/2023,2023,IN,Purdue University,08/31/2023,87233.0
"=""2305854""",no,Travel: NSF Student Travel Grant for 2023 ISOC Symposium on Vehicle Security and Privacy (VehicleSec),CNS,01/15/2023,2023,NY,SUNY at Buffalo,12/31/2023,8000.0
"=""2222965""",no,SBIR Phase I: UpDraft Tower Technology for Geothermal Power Generation and Rankine Cogeneration,TI,01/15/2023,2023,CA,POWERSILO INC,09/30/2023,255966.0
"=""2208433""",no,SBIR Phase I: Cryogenic probe development and testing for post-lumpectomy margin ablation treatment,TI,01/15/2023,2023,CA,"SENOGUARD, INC.",12/31/2023,255731.0
"=""2150106""",no,REU Site: ASL-English Bilingual Summer School in Cognitive and Educational Neuroscience,SMA,01/15/2023,2023,DC,Gallaudet University,12/31/2023,106116.0
"=""2208248""",no,"SBIR Phase I:  Development of novel artificial intelligence (AI)-enabled, non-invasive, heart attack diagnostics",TI,01/15/2023,2023,CA,"RCE TECHNOLOGIES, INC.",09/30/2023,255892.0
"=""2231168""",no,Conference: Climate Change and Quantum Computing,ITE,01/15/2023,2023,NY,General Electric Global Research Center,12/31/2023,98975.0
"=""2208348""",no,SBIR Phase I: Reactive Cyclic Induction Marine Diesel Emissions Reduction Monitoring and Delivery System Project,TI,01/15/2023,2023,RI,"STEC TECHNOLOGY, INC.",12/31/2023,242890.0
"=""2302498""",no,Southwest Local Algebra Meeting 2023,DMS,01/15/2023,2023,TX,University of North Texas,12/31/2023,16000.0
"=""2302019""",no,Conference: 2023 Combinatorial Algebra meets Algebraic Combinatorics (CAAC),DMS,01/15/2023,2023,UT,University of Utah,12/31/2023,13500.0
"=""2206358""",no,DISES: Integrating environmental justice into urban forest assessment and valuation tools: blueprint for the future,DEB,01/15/2023,2023,TX,University of North Texas,04/30/2023,1549219.0
"=""2231665""",no,"IUCRC Planning Grant University of Southern California: Center for CO2 Storage Modeling, Analytics, and Risk Reduction Technologies (CO2-Smart)",RISE,01/15/2023,2023,CA,University of Southern California,12/31/2023,20000.0
"=""2305495""",no,Variants in Biology Education: What can we learn from pandemics?,DUE,01/15/2023,2023,DC,Ecological Society of America,12/31/2023,49975.0
"=""2305321""",no,Conference: SMBE Satellite Meeting On De Novo Gene Birth,MCB,01/15/2023,2023,TX,Texas A&M AgriLife Research,12/31/2023,27619.0
"=""2306373""",no,2023 Mesophotic Coral Reef Ecosystems Gordon Research Conferences,OCE,01/15/2023,2023,RI,Gordon Research Conferences,06/30/2023,30000.0
"=""2306442""",no,I-Corps: Commercial form-factor earbuds for unobtrusive and comfortable sleep monitoring,TI,01/15/2023,2023,CA,University of California-Berkeley,12/31/2023,50000.0
"=""2310682""",no,Collaborative Research: Porous Molecules as a Platform for Solid-State Organometallic Chemistry,CHE,01/15/2023,2023,IN,Indiana University,12/31/2023,90000.0
"=""2222232""",no,STTR Phase I:  Development of an Innovative Ultra High Performance Concrete Foundation System with Bio-inspired Surfaces to Support Renewable Offshore Wind Turbines,TI,01/15/2023,2023,VA,"Precast Systems Engineering, LLC",12/31/2023,274956.0
"=""2151406""",no,"SBIR Phase I:  Scalable, on-demand, research-based, help-seeking innovation for learners in virtual and recorded training programs",TI,01/15/2023,2023,MI,"LEARNINGCLUES, LLC",12/31/2023,256000.0
"=""2313749""",no,Travel: Student Travel Support for Logic Mentoring Workshop 2023,CCF,01/15/2023,2023,IL,DePaul University,12/31/2023,10600.0
"=""2330179""",no,I-Corps: Deployment of antibacterials as seed treatments,TI,01/15/2023,2023,NE,University of Nebraska-Lincoln,10/31/2023,11935.0
"=""2242099""",no,Doctoral Dissertation Research: Navigating Care: A Study of Pediatric Cancer Patients undergoing Palliative Care,BCS,01/15/2023,2023,FL,University of Florida,12/31/2023,30500.0
"=""2308519""",no,I-Corps: Electrospun Nanofiber,TI,01/15/2023,2023,OK,University of Central Oklahoma,12/31/2023,50000.0
"=""2227675""",no,From Vision to Impact: Propagating the Recommendations from the American Psychological Association’s Introductory Psychology Initiative (APA-IPI),DUE,01/01/2023,2023,DC,American Psychological Assoc,12/31/2023,49959.0
"=""2300450""",no,I-Corps: A novel catheter for interventional cardiology,TI,01/01/2023,2023,WA,University of Washington,12/31/2023,50000.0
"=""2246000""",no,"American Geophysical Union (AGU) Chapman Conference on Advances in Understanding Alfven Waves in the Sun and the Heliosphere; Berlin, Germany; May 28-June 2, 2023",AGS,01/01/2023,2023,DC,American Geophysical Union,12/31/2023,49960.0
"=""2229001""",no,Conference: Promoting Student Participation in the 15th International Symposium on Functional Pi Electron Systems,DMR,01/01/2023,2023,NC,North Carolina State University,12/31/2023,10000.0
"=""2228861""",no,FMSG: Eco: Distributed Eco-Manufacturing Using Radio Frequency Heating of Nanomaterials,CMMI,01/01/2023,2023,TX,Texas A&M University,01/31/2023,500000.0
"=""2228251""",no,"Collaborative Research: Evaluating the Unique Composition, Environmental Stability, and Export of Dissolved Pyrogenic Organic Matter in Wildfire-Impacted Watersheds",CBET,01/01/2023,2023,TX,Texas A&M University,01/31/2023,274290.0
"=""2309281""",no,Conference: 2023 Plant Proteolysis Gordon Research Conference,MCB,01/01/2023,2023,RI,Gordon Research Conferences,12/31/2023,20000.0
"=""2241023""",no,"Conference: 2023 Gordon Research Conference and Seminar on Plant Lipids: Structure, Metabolism, and Function",IOS,01/01/2023,2023,RI,Gordon Research Conferences,12/31/2023,20000.0
"=""2245052""",no,"Student Travel Support for the 2023 IEEE/ASME International Conference on Advanced Intelligent Mechatronics; Seattle, Washington; June 28 to July 1, 2023",CMMI,01/01/2023,2023,IA,Iowa State University,12/31/2023,20800.0
"=""2227942""",no,"Collaborative Research: Transformation, interaction and toxicity of emerging 2D nanomaterials free-standing and embedded onto nanocomposite membranes for PFAS degradation",CBET,01/01/2023,2023,NY,SUNY at Buffalo,04/30/2023,254833.0
"=""2308524""",no,RAPID: Exploring Impacts of Cascading Failure and Recovery Efforts of Interdependent Critical Infrastructure in Socially Vulnerable Puerto Rican Communities After Hurricane Fiona,CMMI,01/01/2023,2023,NY,SUNY at Buffalo,12/31/2023,49999.0
"=""2301333""",no,Conference: USA-Africa Workshop on Communications and Microwave Emerging Technologies,ECCS,01/01/2023,2023,AR,University of Arkansas,12/31/2023,49990.0
"=""2314202""",no,"COLLABORATIVE RESEARCH: EAGER: Towards Building a CyberInfrastructure for Facilitating the Assessment, Dissemination, Discovery, & Reuse of Software and Data Products",OAC,01/01/2023,2023,MI,Wayne State University,10/31/2023,48623.0
