award_id,cancelled_trump,title,directorate,start_date,year,state,org_name,end_date,award_amount
"=""2034809""",no,RAPID: Social isolation during COVID-19: Effects on fear learning and implications for trauma,BCS,06/15/2020,2020,CA,University of California-Los Angeles,05/31/2021,116722.0
"=""2030129""",no,RAPID: National Drosophila Species Stock Center Covid-19 Relief and Recovery,DBI,06/15/2020,2020,NY,Cornell University,05/31/2021,198710.0
"=""2027891""",no,RAPID: Geospatially-Enabled Deep Analytics for Real-time Mitigation and Response to COVID-19 Outbreak for American Rural Populations,IIS,06/15/2020,2020,MO,University of Missouri-Columbia,05/31/2021,200000.0
"=""2031977""",no,RAPID: Using Smartphones to detect and monitor respiratory symptoms in COVID-19 patients,IIS,06/15/2020,2020,NY,Cornell University,05/31/2021,99975.0
"=""2039432""",no,"Collaborative Research: Multi-Parameter Geophysical Constraints on Volcano Dynamics of Mt. Erebus and Ross Island, Antarctica",OPP,06/15/2020,2020,AK,University of Alaska Fairbanks Campus,02/28/2021,25735.0
"=""2037640""",no,I-Corps:  Photobiomodulation device for the treatment of neurodegenerative diseases,TI,06/15/2020,2020,NY,Icahn School of Medicine at Mount Sinai,11/30/2021,50000.0
"=""2031101""",no,RAPID: Stress and Emotional Response to Uncertainty in the COVID-19 Pandemic,BCS,06/15/2020,2020,NE,University of Nebraska-Lincoln,05/31/2021,87825.0
"=""2013780""",no,I-Corps:  Smart Light-Emitting Diodes for Micro-Displays,TI,06/15/2020,2020,NJ,New Jersey Institute of Technology,11/30/2021,50000.0
"=""1942430""",no,CAREER: Maximal and Scalable Unified Debugging for the JVM Ecosystem,CCF,06/15/2020,2020,TX,University of Texas at Dallas,06/30/2021,190667.0
"=""2031901""",no,EAGER: CPR-COVID-19 Prevention Robot in Dense Areas,IIS,06/15/2020,2020,MD,"University of Maryland, College Park",05/31/2021,120000.0
"=""2035101""",no,Collaborative Research: RAPID: Virtual Conference Platform,CCF,06/15/2020,2020,PA,University of Pennsylvania,05/31/2021,36452.0
"=""2032011""",no,RAPID: Collaborative Research: Immunological adaptations in bats to moderate the effect of coronavirus infection,IOS,06/15/2020,2020,NY,CUNY John Jay College of Criminal Justice,05/31/2021,21310.0
"=""2029511""",no,"RAPID: Coronavirus, new patterns in electricity demand, and energy inequality",ECCS,06/15/2020,2020,MD,"University of Maryland, College Park",05/31/2021,199996.0
"=""2006995""",no,Collaborative Research: SHF: Small: Interactive Synthesis and Repair For Robot Programs,CCF,06/15/2020,2020,MA,University of Massachusetts Amherst,12/31/2020,200000.0
"=""2031195""",no,RAPID: Data-Driven Models to Optimize Ventilator Therapy in ICU COVID Patients,ECCS,06/15/2020,2020,MD,Johns Hopkins University,05/31/2021,200000.0
"=""2016026""",no,ACL 2020 Student Workshop,IIS,06/15/2020,2020,CA,University of California-Davis,11/30/2020,14980.0
"=""2034584""",no,EAGER: Investigating the Hinge Mechanics of the Spike Protein to Understand the Coronavirus Infection Mechanism,CMMI,06/15/2020,2020,IL,Northwestern University,11/30/2021,188034.0
"=""2033384""",no,Workshop on Drug Repurposing for Future Pandemics,IIS,06/15/2020,2020,MA,Harvard University,11/30/2020,29952.0
"=""2033846""",no,RAPID: Dual COVID-19 and Influenza Virus Detection via Target Antibody-Functionalized Graphene Field-Effect Sensing,ECCS,06/15/2020,2020,TX,University of Texas at Austin,05/31/2021,150000.0
"=""2031391""",no,RAPID: Communicating difficult medical choices in a COVID-19 context,BCS,06/15/2020,2020,FL,Florida State University,07/31/2021,61086.0
"=""2027984""",no,RAPID: Collaborative: Transfer Learning Techniques for Better Response to COVID-19 in the US,CNS,06/15/2020,2020,NJ,"Rutgers, The State University of New Jersey-RBHS-Robert Wood",05/31/2021,25000.0
"=""2037595""",no,eRulemaking program annual contribution for FY20,OGC,06/15/2020,2020,DC,GENERAL SERVICES ADMINISTRATION,06/15/2021,18904.0
"=""2032384""",no,RAPID: Infection Transmission of COVID19 in Urban Neighborhoods,BCS,06/15/2020,2020,MA,Northeastern University,05/31/2021,199718.0
"=""2007066""",no,SHF:Small:A Language-based Approach to Faster and Safer Serverless Computing,CCF,06/15/2020,2020,MA,University of Massachusetts Amherst,12/31/2020,450000.0
"=""2033926""",no,RAPID: Psychosocial Determinants of Successful Remote Learning During the Covid-19 Pandemic: A Study of Promoters and Barriers faced by HBCU Students,CNS,06/15/2020,2020,NC,North Carolina Agricultural & Technical State University,08/31/2021,199997.0
"=""2029258""",no,"RAPID: Examining Media Dependencies, Risk Perceptions, and Depressive Symptomatology during the 2020 COVID Pandemic",SES,06/15/2020,2020,CT,University of Connecticut,05/31/2021,66453.0
"=""2003248""",no,Doctoral Dissertation Research: Assessing Factors that Influence Streamflow,BCS,06/15/2020,2020,OH,"OHIO STATE UNIVERSITY, THE",11/30/2021,17023.0
"=""2029539""",no,Virtual Workshops on the Response of Higher Education to COVID-19,DUE,06/15/2020,2020,DC,National Academy of Sciences,05/31/2021,100000.0
"=""2019568""",no,I-Corps: Fourth Wall Optics,TI,06/15/2020,2020,TX,University of Texas at Austin,11/30/2021,50000.0
"=""2031819""",no,RAPID: Comprehensive Interaction and Annotation (CIA) Analysis of the SARS-CoV-2 Genome and Related Genomes,DBI,06/15/2020,2020,AZ,Translational Genomics Research Instittue,05/31/2021,199999.0
"=""2029009""",no,"RAPID: Collaborative Research: Local Government Response to COVID-19: Juneau, Alaska, a case study in adaptive governance, risk management, communication, and decision-making",OPP,06/15/2020,2020,AK,University of Alaska Fairbanks Campus,05/31/2021,43000.0
"=""2012658""",no,Polynomial Optimization and Finite Element Methods for Nonlinear Mechanics,DMS,06/15/2020,2020,NY,Cornell University,08/31/2021,61947.0
"=""2039257""",no,"Collaborative Research: A Biotic Inventory of Terrestrial Vertebrates, Spiders, and Haemosporidian Parasites of Sulawesi, Indonesia",DEB,06/08/2020,2020,NY,CUNY City College,09/30/2021,15564.0
"=""1922425""",no,Dimensions of Care Giving and Eldercare Technology in an Aging Society,BCS,06/01/2020,2020,IL,The Art Institute of Chicago,01/31/2021,75788.0
"=""2012157""",no,STTR Phase I:  High Performance Microalgae Building Enclosures for Energy Efficient Retrofitting Application,TI,06/01/2020,2020,NC,ECOCLOSURE LLC,05/31/2021,225000.0
"=""2026275""",no,I-Corps:  Acoustic Filters for Next Generation Wireless Handsets,TI,06/01/2020,2020,PA,Carnegie Mellon University,11/30/2021,50000.0
"=""2030883""",no,RAPID: Challenges and Novel Responses in Law Enforcement and Criminal Courts  to the COVID-19 Pandemic,SES,06/01/2020,2020,DC,American University,08/31/2021,157138.0
"=""1949848""",no,Building Capacity to Produce STEM Teachers at a Hispanic Serving Institution in Illinois,DUE,06/01/2020,2020,IL,Aurora University,05/31/2021,74910.0
"=""1954014""",no,"The Interplay between Combinatorics, Set Theory, and Dynamics",DMS,06/01/2020,2020,PA,Carnegie Mellon University,09/30/2020,160000.0
"=""2030074""",no,"RAPID: Collaborative Research: Social interactions. social connectedness, and health outcomes during the COVID-19 pandemic",BCS,06/01/2020,2020,PA,Carnegie Mellon University,05/31/2021,173979.0
"=""2032500""",no,"RAPID: Collaborative Research: Low-Cost, Non-invasive, Fast Sample Collection System for COVID-19 Viral Load Level Diagnosis: Point-of-Care and Environmental Testing",CBET,06/01/2020,2020,MA,University of Massachusetts Amherst,05/31/2021,30000.0
"=""2013880""",no,SBIR Phase I:  Enabling Better Grid-Scale Energy Storage with Organic Additives,TI,06/01/2020,2020,OH,"Octet Scientific, Inc.",05/31/2021,225000.0
"=""2015140""",no,SBIR Phase I:  A Realtime Atmospheric Mapping and Monitoring System to Enable a Next-Generation Global Navigation Service,TI,06/01/2020,2020,CA,XONA SPACE SYSTEMS INC.,05/31/2021,225000.0
"=""2001310""",no,SBIR Phase I:  Protoflight Design and Validation of Molten Regolith Electrolysis Facility For Lunar In-Situ Resource Utilization,TI,06/01/2020,2020,TX,"LUNAR RESOURCES, INC.",02/28/2021,225000.0
"=""2006130""",no,SBIR Phase I:  A non-viral gene editing platform for cell therapies in the veterinary market,TI,06/01/2020,2020,MN,LIFENGINE ANIMAL HEALTH LABORATORIES INCORPORATED,10/31/2021,225000.0
"=""2029950""",no,Collaborative Research: RAPID: Addressing Transit Accessibility and Public Health Challenges due to COVID-19,CNS,06/01/2020,2020,TN,Vanderbilt University,12/31/2021,54912.0
"=""2014870""",no,STTR Phase I:  SynchronyGamma – A Music-Based Intervention for Alzheimer’s and MCI,TI,06/01/2020,2020,CT,"OSCILLOSCAPE, LLC",08/31/2021,224846.0
"=""1953772""",no,Algebraic and Probabilistic Methods in Extremal Combinatorics,DMS,06/01/2020,2020,CA,Stanford University,11/30/2020,147378.0
"=""2029812""",no,"I-Corps:  A cloud-based searchable catalog to link geographically and population diverse patient genomic, phenotypic and clinical data",TI,06/01/2020,2020,CA,University of California-Los Angeles,11/30/2021,50000.0
"=""2030382""",no,Collaborative Research: RAPID: Understanding and Facilitating Remote Triage and Rehabilitation During Pandemics via Visual Based Patient Physiologic Sensing,ECCS,06/01/2020,2020,MD,University of Maryland at Baltimore,05/31/2021,8425.0
"=""2032082""",no,Collaborative Research: RAPID: Integrative Modeling of Intervention Serology and the Role of Shield Immunity in Reducing COVID-19 Epidemic Spread,DEB,06/01/2020,2020,GA,Georgia Tech Research Corporation,05/31/2021,99430.0
"=""2032072""",no,RAPID: Comparative CRISPR Genetic Screens to Understand Zoonotic Transmission of  SARS-CoV-2,IOS,06/01/2020,2020,MA,University of Massachusetts Medical School,12/31/2021,200000.0
"=""2011353""",no,I-Corps:  Software platform to bridge the gap between code editors and visuals editors in digital marketing agencies,TI,06/01/2020,2020,IL,University of Chicago,11/30/2021,50000.0
"=""2032273""",no,EAGER: Coronavirus infection of human lung epithelium and leukocytes: mechanisms and treatment,CBET,06/01/2020,2020,GA,Emory University,05/31/2021,199999.0
"=""2027693""",no,STTR Phase I:  Autonomous Disinfecting Robot for Crowded Spaces,TI,06/01/2020,2020,IL,"EarthSense, Inc.",05/31/2021,256000.0
"=""2031153""",no,RAPID: COVID-19: New Handheld Gas Sensors for Airborne SARS-CoV-2 Virus: Instant COVID-19 Diagnosis from Exhaled Breath,ECCS,06/01/2020,2020,MA,University of Massachusetts Medical School,05/31/2021,99999.0
"=""2017133""",no,I-Corps: Water Purification Membranes Made using Green Solvents,TI,06/01/2020,2020,KY,University of Kentucky Research Foundation,11/30/2021,50000.0
"=""2016333""",no,I-Corps:  Vacuum Stripping and Absorption to Recover Ammonia from Wastewater,TI,06/01/2020,2020,NY,SUNY College of Environmental Science and Forestry,12/31/2021,50000.0
"=""2014714""",no,"SBIR Phase I:  Gestural/Haptic Tongue Interface Wearable: Hands-free, Heads-up, and Private Interactivity",TI,06/01/2020,2020,CA,Wield LLC,09/30/2021,244808.0
"=""2027254""",no,"RAPID: Leveraging Twitter Data for Real-time Public Health Responses to Coronavirus: Identifying Affective Desensitization, Loneliness and Depression, and Trust",IIS,06/01/2020,2020,CA,University of California-Irvine,05/31/2021,180000.0
"=""2030571""",no,RAPID: Collaborative Research: Development of Biocidal Nanofiber Air Filters for Reusable Personal Protective Equipment during Outbreaks of Viral Pathogens,CBET,06/01/2020,2020,IN,University of Notre Dame,09/30/2021,99985.0
"=""2031031""",no,I-Corps: Smart IoT Medicine Dispensing,TI,06/01/2020,2020,VA,George Mason University,11/30/2020,50000.0
"=""2032501""",no,"RAPID: Collaborative Research: Low-Cost, Non-invasive, Fast Sample Collection System for COVID-19 Viral Load Level Diagnosis: Point-of-Care and Environmental Testing",CBET,06/01/2020,2020,MA,Northeastern University,05/31/2021,30000.0
"=""2032481""",no,Virtual Workshops for GEO REU Students and PIs During COVID-19,OCE,06/01/2020,2020,CO,University Corporation For Atmospheric Res,05/31/2021,48449.0
"=""2027521""",no,Collaborative Research: RAPID: Building a Spatiotemporal Platform for Rapid Response to COVID-19,CNS,06/01/2020,2020,VA,George Mason University,08/31/2021,99956.0
"=""2029584""",no,RAPID: Increasing Healthcare Credential Open Data in Response to COVID-19,ITE,06/01/2020,2020,DC,"CREDENTIAL ENGINE, INC.",03/31/2021,54250.0
"=""2030845""",no,RAPID: Exploring the Cyber Behaviors of Temporary Work-From-Home (TWFH) Employees,SES,06/01/2020,2020,FL,The University of Central Florida Board of Trustees,05/31/2021,170249.0
"=""2031495""",no,RAPID: Collaborative Research: Data Analytics for Mechano-acoustic and Physiological Monitoring of COVID19 Symptoms,ECCS,06/01/2020,2020,IL,Northwestern University,05/31/2021,83784.0
"=""2012896""",no,"NSF INCLUDES Planning Grant: Creating the Networks That Can Build and Sustain Inclusive, Workforce-relevant STEM Courses for Underrepresented Students",EES,06/01/2020,2020,VA,American Institutes for Research in the Behavioral Sciences,05/31/2021,100000.0
"=""2014176""",no,SBIR Phase I:  High efficiency nozzles for fire fighting,TI,06/01/2020,2020,CA,HEN NOZZLES INC.,07/31/2021,225000.0
"=""2015136""",no,SBIR Phase I:  VCSELA Wireless Technology,TI,06/01/2020,2020,NM,"OptiPulse, Inc",05/31/2021,233276.0
"=""2000726""",no,Geometry and Topology of Holomorphic Symplectic Varieties,DMS,06/01/2020,2020,MA,Massachusetts Institute of Technology,06/30/2021,159159.0
"=""1953946""",no,Analytic and Algebraic Methods in Discrete Geometry,DMS,06/01/2020,2020,MA,Massachusetts Institute of Technology,04/30/2021,48505.0
"=""2031096""",no,RAPID: Covid-19 Forecasting Models for Removal of Social Distancing Measures,DEB,06/01/2020,2020,WA,University of Washington,11/30/2020,198048.0
"=""2027586""",no,STTR Phase I:  COVID-19: AI-based Development of Neutralizing Antibodies for SARS-CoV-2,TI,06/01/2020,2020,CA,Protabit LLC,11/30/2020,256000.0
"=""2001077""",no,Summer School for Young Researchers on Representations of Finite Groups,DMS,06/01/2020,2020,CO,Metropolitan State University of Denver,05/31/2021,10000.0
"=""2031077""",no,RAPID: SaTC: COVID19: Science of using wirelessly powered sensors to quickly scale up verifiable decontamination of individual N95 respirator masks,CNS,06/01/2020,2020,MI,Regents of the University of Michigan - Ann Arbor,05/31/2021,200000.0
"=""2029157""",no,EAGER: Collaborative Research: Origami-Based Extremely-Packed Multistable Pop-Up Design for Medical Masks,EFMA,06/01/2020,2020,GA,Georgia Tech Research Corporation,05/31/2021,50000.0
"=""2030017""",no,"RAPID: Collaborative Research: Social interactions, social connectedness, and health outcomes during the COVID-19 pandemic",BCS,06/01/2020,2020,PA,University of Pittsburgh,05/31/2021,8295.0
"=""2028187""",no,SBIR Phase I:  HaloFilm as a virucide against COVID-19 infection,TI,06/01/2020,2020,NY,HALOMINE INC.,02/28/2021,256000.0
"=""2013707""",no,SBIR Phase I:  Integrated propulsion solution to enable reusable upper stages of space vehicles,TI,06/01/2020,2020,WA,"STOKE SPACE TECHNOLOGIES, INC.",02/28/2021,225000.0
"=""2014617""",no,FSML: A culture facility for small marine organisms at Shannon Point Marine Center,DBI,06/01/2020,2020,WA,Western Washington University,05/31/2021,182413.0
"=""2033137""",no,RAPID COVID-19 DCL response: Wastewater Pathogen Tracking Dashboard,DEB,06/01/2020,2020,OH,Battelle Memorial Institute,05/31/2021,197375.0
"=""1946947""",no,Doctoral Dissertation Research: Social and Cultural Drivers of Assistive Device Design and Re-Design for People Living in Low-Resource Settings,SES,06/01/2020,2020,NC,University of North Carolina at Chapel Hill,11/30/2021,9572.0
"=""2031637""",no,RAPID: Prototype of a medical mask using a novel antimicrobial / antiviral biofilter material,CBET,06/01/2020,2020,WV,West Virginia University Research Corporation,08/31/2021,198499.0
"=""2031217""",no,RAPID: Responding to extreme heat in the time of COVID-19,BCS,06/01/2020,2020,CO,University Corporation For Atmospheric Res,12/31/2021,199923.0
"=""1929208""",no,RII Track-4: Mechanistic Design of Hierarchical Metal-MAX Multilayered Nanocomposites,OIA,06/01/2020,2020,NV,"Board of Regents, NSHE, obo University of Nevada, Reno",10/31/2020,300000.0
"=""2032408""",no,"RAPID: Low-cost, Batteryless Smart Personal Protective Equipment (PPE) Tackling the COVID-19 Pandemic",CNS,06/01/2020,2020,IL,Northwestern University,10/31/2021,200000.0
"=""1933298""",no,"Collaborative Research: Using Ca, Sr, Mg, and Fe isotope proxies to constrain redox and continental weathering during Ocean Anoxic Event 2",EAR,06/01/2020,2020,WY,University of Wyoming,03/31/2021,90372.0
"=""2002778""",no,Convex Body Shape Recovery via Geometric Measures and Inequalities,DMS,06/01/2020,2020,MA,Massachusetts Institute of Technology,05/31/2021,159159.0
"=""2016168""",no,I-Corps:  Coupled High and Low-Frequency Ultrasonic for the Destruction of Organics,TI,06/01/2020,2020,NJ,New Jersey Institute of Technology,11/30/2021,50000.0
"=""2014678""",no,STTR Phase I:  Long Stroke Micromachined Arrayed Cell Electrostatic Actuators for Highly Integrated Micro-Positioning,TI,06/01/2020,2020,TX,"SILICON DYNAMIX, INC.",05/31/2021,225000.0
"=""2029498""",no,RAPID: Understanding increased social bias during the COVID-19 crisis in the United States,SES,06/01/2020,2020,NY,Cornell University,05/31/2021,192235.0
"=""2014688""",no,SBIR Phase I:  Rapid Design and Prototyping System for Lab-On-Chip Devices,TI,06/01/2020,2020,MA,"Parallel Fluidics, Inc.",03/31/2021,225000.0
"=""2033838""",no,RAPID: Screening and Prognosis of COVID-19 by a Novel RF Stethoscope,ECCS,06/01/2020,2020,NY,Cornell University,08/31/2021,200000.0
"=""1926379""",no,Research in Residence: Addressing Community Challenges Through University-Government Collaboration,CNS,06/01/2020,2020,CA,CITY INNOVATE INC,05/31/2021,295446.0
"=""2016089""",no,SBIR Phase I:  Chalcogenide Polymer Infrared Optics,TI,06/01/2020,2020,AZ,"NORCON TECHNOLOGIES, LLC",05/31/2021,280870.0
"=""2027109""",no,I-Corps: Interferometric Imaging for Multiplexed Molecular Kinetics,TI,06/01/2020,2020,MA,Trustees of Boston University,11/30/2021,50000.0
"=""2014659""",no,SBIR Phase I:  Automated Building Scale Urine Treatment System,TI,06/01/2020,2020,VT,RICH EARTH LLC,11/30/2021,244994.0
"=""2003489""",no,Collaborative Research: Deployment of Seafloor Optical Fiber Strainmeters for the Detection of Slow Slip Events,OCE,06/01/2020,2020,CA,University of California-Berkeley,04/30/2021,40209.0
"=""2028485""",no,RAPID: COVID-19 Information Exposure and Messaging Effects,SES,06/01/2020,2020,NH,Dartmouth College,05/31/2021,199027.0
"=""2032345""",no,"RAPID: Collaborative Research: VAPOC: Visualization, Analysis and Prediction of COVID-19",CNS,06/01/2020,2020,DC,University of the District of Columbia,09/30/2021,59999.0
"=""2031591""",no,"RAPID: Pandemic Anxiety, Recovery, and Inequality:  Evaluating Institutions and Policy in a Coronavirus Hotspot",SES,06/01/2020,2020,LA,Louisiana State University,05/31/2021,138613.0
"=""1950351""",no,Mentors First: Building Capacity to Develop STEM Teachers who Can Include English as a Second Language Instruction in their STEM Classes,DUE,06/01/2020,2020,WA,Evergreen State College,05/31/2021,111148.0
"=""2029696""",no,Collaborative Research: RAPID: Spatial Modeling of Immune Response to Multifocal SARS-CoV-2 Viral Lung Infection,IOS,06/01/2020,2020,AZ,Arizona State University,05/31/2021,79864.0
"=""2031204""",no,RAPID: Analyses of polymorphism and divergence to illuminate molecular evolution permissive of zoonoses in SARS and COVID-19,DEB,06/01/2020,2020,CT,Yale University,05/31/2021,122716.0
"=""2032904""",no,RAPID - COVID-19 target epitopes and human genetic factors of virulence,DBI,06/01/2020,2020,TX,Baylor College of Medicine,05/31/2021,200000.0
"=""2032084""",no,Collaborative Research: RAPID: Integrative Modeling of Intervention Serology and the Role of Shield Immunity in Reducing COVID-19 Epidemic Spread,DEB,06/01/2020,2020,GA,Emory University,05/31/2021,99999.0
"=""1941952""",no,CAREER: Understanding Latinx Students' Stories of Doing and Learning Mathematics,DRL,06/01/2020,2020,SC,Clemson University,09/30/2020,153478.0
"=""1945321""",no,CAREER: Mixed-bonded IV-VI semiconductors for hybrid heterostructures,DMR,06/01/2020,2020,CA,University of California-Santa Barbara,07/31/2020,112140.0
"=""1952531""",no,FRG: Collaborative Research: Algebraic Geometry and Singularities in Positive and Mixed Characteristic,DMS,06/01/2020,2020,MA,Massachusetts Institute of Technology,07/31/2021,102806.0
"=""1954304""",no,Estimates on eigenvalues and eigenfunctions in convex settings,DMS,06/01/2020,2020,NC,University of North Carolina at Chapel Hill,09/30/2020,35704.0
"=""2031919""",no,Integrated Activities Environment (IAE Loans and Grants) IAA,BFA,06/01/2020,2020,DC,"GSA, OFFICE OF ACQUISITION SYSTEMS",06/01/2021,719644.0
"=""2005539""",no,Floer Homology and Low-Dimensional Topology,DMS,06/01/2020,2020,NJ,Institute For Advanced Study,12/31/2020,107908.0
"=""2014229""",no,SBIR Phase I:  Eyes in Sync,TI,06/01/2020,2020,CA,Eyes in Synch LLC,08/31/2021,245000.0
"=""2030117""",no,Collaborative Proposal: RAPID: Thermal Sterilization of Personal Protective Equipment Contaminated with SARS-CoV-2,CBET,06/01/2020,2020,TX,University of Texas Medical Branch at Galveston,05/31/2021,79000.0
"=""2029788""",no,RAPID: Campus Coronavirus Response,ITE,06/01/2020,2020,MA,Tufts University,05/31/2021,133934.0
"=""2015008""",no,SBIR Phase I:  Development of AI Software to Capture and Identify Circulating Rare Cells in Lung Patients,TI,06/01/2020,2020,VA,Axon Dx LLC,11/30/2021,224426.0
"=""2015128""",no,SBIR Phase I:  Composite Coatings for Improving Energy Efficiency of Building Envelope Systems,TI,06/01/2020,2020,AZ,ENKOAT LLC,05/31/2021,249996.0
"=""2031429""",no,FY20 Budget Formulation Execution Line of Business (BFELoB),BFA,06/01/2020,2020,DC,Department of Education,06/01/2021,110000.0
"=""2013819""",no,SBIR Phase I:  Zwitterion self-assembly during evaporation process correlated to thin film mechanical function,TI,06/01/2020,2020,TX,Rochal Industries LLC,07/31/2021,222981.0
"=""2014792""",no,SBIR Phase I:  A Microbial Inoculant for the Degradation and Recycling of Hemp Waste into a Nutrient-Rich Fertilizer,TI,06/01/2020,2020,VT,"FULL CIRCLE MICROBES, INC.",08/31/2021,224935.0
"=""2014996""",no,"SBIR Phase I:  High-speed, precision wire plotting for electromechanical sensors and actuators",TI,06/01/2020,2020,CA,"FOLI RESEARCH, LLC",03/31/2021,224700.0
"=""1948268""",no,"RUI: Collaborative Research: Testing the controls on eruption size and style at intermediate arc volcanoes: Evidence from the Holocene record at Augustine Volcano, USA",EAR,06/01/2020,2020,VT,Middlebury College,07/31/2021,82697.0
"=""2014645""",no,STTR Phase I:  Biomimetic Solution for Gesture-Based Human Machine Interactions,TI,06/01/2020,2020,WV,NEUROWIRED,08/31/2021,244999.0
"=""2027721""",no,"SBIR Phase I:  MouthLab - A Medical Tricorder Optimized for Real-time, Rapid Assessment of COVID-19 Patients And Those At Risk",TI,06/01/2020,2020,MD,"AIDAR HEALTH, INC",11/30/2020,256000.0
"=""2028412""",no,"RAPID: A Multi-Wave Study of Risk Perception, Information Seeking, and Protective Action in COVID-19",CMMI,06/01/2020,2020,NY,SUNY at Albany,05/31/2021,47972.0
"=""2000192""",no,Multiplicities and Period Integrals for Spherical Varieties,DMS,06/01/2020,2020,MA,Massachusetts Institute of Technology,12/31/2020,51936.0
"=""2031142""",no,RAPID: COVID-19: New Handheld Gas Sensors for Airborne SARS-CoV-2 Virus: Instant COVID-19 Diagnosis from Exhaled Breath,ECCS,06/01/2020,2020,MA,Northeastern University,05/31/2021,100000.0
"=""2029952""",no,Collaborative Research: RAPID: Addressing Transit Accessibility and Public Health Challenges due to COVID-19,CNS,06/01/2020,2020,TX,University of Houston,05/31/2021,44945.0
"=""2032122""",no,RAPID: Investigating the impact of online internships in the midst of the COVID-19 pandemic,DGE,06/01/2020,2020,WI,University of Wisconsin-Madison,12/31/2021,145000.0
"=""2030532""",no,RAPID: Collaborative Research: Development of Biocidal Nanofiber Air Filters for Reusable Personal Protective Equipment during Outbreaks of Viral Pathogens,CBET,06/01/2020,2020,IA,University of Iowa,09/30/2021,99974.0
"=""1953242""",no,"A database for an understudied language: A dictionary, grammar, and texts with sound",BCS,06/01/2020,2020,OK,The Delaware Tribe,11/30/2021,33280.0
"=""2027792""",no,"RAPID: How Scientific Data, Knowledge, and Expertise Mobilize in Online Media during the COVID-19 Crisis",CNS,06/01/2020,2020,WA,University of Washington,09/30/2021,197538.0
"=""2029512""",no,RAPID:Working Parents and Childcare during the Coronavirus Disease (COVID-19) Pandemic,SES,06/01/2020,2020,IA,University of Iowa,08/31/2021,66375.0
"=""1953822""",no,"STTR Phase I:  Computerized System for Detection, Assessment, and Visualization of Intraoperative Bleeding During Robotic and Laparoscopic Surgery",TI,06/01/2020,2020,MI,"REDIMINDS, INC.",05/31/2021,225000.0
"=""2014753""",no,STTR Phase I: Development and Commercialization of the SafeLight Family of Antimicrobial Materials for Combatting the COVID-19 Pandemic and Hospital Acquired Infections,TI,06/01/2020,2020,NC,"PHOTOCIDE PROTECTION, INC.",12/31/2021,225000.0
"=""1939543""",no,Micromechanics of Interactions Between Hard Magnetic Particles and Soft Matrix on Magneto-Mechanical Actuation,CMMI,06/01/2020,2020,OH,"OHIO STATE UNIVERSITY, THE",09/30/2021,398773.0
"=""2032533""",no,"RAPID: Collaborative Research: Low-Cost, Non-invasive, Fast Sample Collection System for COVID-19 Viral Load Level Diagnosis: Point-of-Care and Environmental Testing",CBET,06/01/2020,2020,CA,University of California-Los Angeles,12/31/2021,90000.0
"=""2030023""",no,Collaborative Proposal: RAPID: Thermal Sterilization of Personal Protective Equipment Contaminated with SARS-CoV-2,CBET,06/01/2020,2020,TX,William Marsh Rice University,05/31/2021,80000.0
