award_id,cancelled_trump,title,directorate,start_date,year,state,org_name,end_date,award_amount
"=""2111561""",no,"Improving Engineering Student Engagement, Self-Efficacy, Diversity Awareness, and Retention using Visualization and Virtual/Augmented Reality Technologies",DUE,10/15/2021,2021,NE,University of Nebraska-Lincoln,11/30/2021,1700000.0
"=""2114791""",no,FW-HTF-P/Collaborative Research: Exploring Tools to Help Workers and Organizations Adapt to AI-enabled Robots,IIS,10/01/2021,2021,CA,Stanford University,12/31/2021,77198.0
"=""2132301""",no,Cyber-Physical Systems Virtual Organization: CPS Community and the Data Revolution,CNS,10/01/2021,2021,AZ,University of Arizona,10/31/2021,1200000.0
"=""2106972""",no,III: Medium: Collaborative Research: Self-Supervised Recommender System Learning with Application Specific Adaption,IIS,10/01/2021,2021,FL,Florida State University,11/30/2021,600000.0
"=""2108837""",no,Modulation of Metalloprotein Activities through Fine-tuning Reduction Potentials,CHE,10/01/2021,2021,IL,University of Illinois at Urbana-Champaign,12/31/2021,561000.0
"=""2128926""",no,FW-HTF-T/Collaborative Research: Occupational Exoskeletons and the Human-Technology Partnership: Achieving Scale and Integration into the Future of Work,OIA,10/01/2021,2021,VA,Virginia Polytechnic Institute and State University,12/31/2021,3574513.0
"=""2044972""",no,CAREER: Understanding the Corrosion Fatigue Behavior of Additively Processed Metals through an Integrated Experimental and Computational Approach,CMMI,10/01/2021,2021,OH,University of Cincinnati Main Campus,10/31/2021,594948.0
"=""2107530""",no,Collaborative Research: OAC CORE: Large-Scale Spatial Machine Learning for 3D Surface Topology in Hydrological Applications,OAC,10/01/2021,2021,AL,University of Alabama Tuscaloosa,10/31/2021,261161.0
"=""2101881""",no,CNS Core: Small: Fast or Dynamic Websites? Eliminating the Need to Choose,CNS,10/01/2021,2021,CA,University of California-Los Angeles,10/31/2021,500000.0
"=""2114294""",no,Collaborative Research: CIF: FET: Small: Realizing Joint Detection Receivers for Quantum-enhanced Optical Communications using Photonic NISQ-era Quantum Processors,CCF,10/01/2021,2021,AZ,University of Arizona,12/31/2021,194087.0
"=""2118155""",no,Collaborative Research: CyberTraining: Implementation: Medium: Establishing Sustainable Ecosystem for Computational Molecular Science Training and Education,OAC,10/01/2021,2021,SC,Clemson University,11/30/2021,105000.0
"=""2126297""",no,Collaborative Research: SaTC: CORE: Medium: Novel Algorithms and Tools for Empowering People Who Are Blind to Safeguard Private Visual Content,CNS,10/01/2021,2021,TX,University of Texas at Austin,10/31/2021,567706.0
"=""2055077""",no,Strengthening the Industry 4.0 Workforce through Virtual Reality Training Modules,DUE,10/01/2021,2021,KY,Owensboro Community & Technical College,10/31/2021,593464.0
"=""2053280""",no,Unravelling the Role of Subglacial Channels in Ice Stream Evolution,OPP,09/15/2021,2021,GA,Georgia Tech Research Corporation,10/31/2021,1239283.0
"=""2108986""",no,Collaborative Research: RUI: Star-Planet Interactions Around Low-mass Stars,AST,09/01/2021,2021,MD,St Mary's College of Maryland,10/31/2021,138060.0
"=""2101916""",no,Higher Representation Theory and Heegaard Floer Homology,DMS,09/01/2021,2021,CA,University of Southern California,10/31/2021,157847.0
"=""2042384""",no,CAREER: Partial Differential Equation and Randomness,DMS,09/01/2021,2021,PA,Carnegie Mellon University,11/30/2021,20209.0
"=""2121872""",no,"ADVANCE Partnership: Faculty Online Learning Communities for Gender Equity, Targeting Department Level Change in STEM",EES,09/01/2021,2021,CO,University of Colorado at Boulder,10/31/2021,257454.0
"=""2105145""",no,CRII:SCH:RUI: A Digital Identity System for Accelerating Medical Communications within Rare Disease Communities,IIS,09/01/2021,2021,TN,Belmont University,10/31/2021,160482.0
"=""2124985""",no,Collaborative Research: Responsible Engineering across Cultures: Investigating the Effects of Culture and Education on Ethical Reasoning and Dispositions of Engineering Students,SMA,09/01/2021,2021,NJ,Rowan University,12/31/2021,198562.0
"=""2045773""",no,CAREER: Teaching Machines to Recognize Complex Visual Concepts in Images through Compositionality,IIS,09/01/2021,2021,VA,University of Virginia Main Campus,11/30/2021,149760.0
"=""2108573""",no,"Inviscid Limits, Uniqueness, and Anomalous Dissipation in Hydrodynamics",DMS,09/01/2021,2021,WY,University of Wyoming,09/30/2021,124477.0
"=""2126644""",no,OCE-PRF: Quantifying Magmatic Influences on the Longevity of Segmented Transform Fault Systems,OCE,09/01/2021,2021,MA,Boston College,12/31/2021,44097.0
"=""2116324""",no,Continuous Twisted Nano-fibrous Yarns for Smart Piezo-Textiles,ECCS,08/15/2021,2021,TX,University of Texas at Dallas,09/30/2021,397113.0
"=""2115360""",no,HNDS-R Collaborative Research: Measuring Belief Distortions to Improve Predictive Outcomes,SES,08/15/2021,2021,NC,Duke University,10/31/2021,173194.0
"=""2121222""",no,"CCSS: Collaborative Research: Quality-Aware Distributed Computation for Wireless Federated Learning:  Channel-Aware User Selection, Mini-Batch Size Adaptation, and Scheduling",ECCS,08/15/2021,2021,AZ,Arizona State University,12/31/2021,219999.0
"=""2115107""",no,CICI: UCSS: Towards Secure and Usable Push Notification Authentication for Collaborative Scientific Infrastructures,OAC,08/15/2021,2021,AL,University of Alabama at Birmingham,09/30/2021,499934.0
"=""2111578""",no,Collaborative Research: Expanding Subgoal Labels for Imperative Programming to Further Improve Student Learning Outcomes,DUE,08/01/2021,2021,NE,University of Nebraska at Omaha,08/31/2021,401553.0
"=""2104009""",no,Collaborative Research: Frameworks: Convergence of Bayesian inverse methods and scientific machine learning in Earth system models through universal differentiable programming,OAC,08/01/2021,2021,CA,University of California-Irvine,09/30/2021,461611.0
"=""2141976""",no,HRLOB,HRM,08/01/2021,2021,PA,OFFICE OF PERSONNEL MANAGEMENT,08/19/2021,0.0
"=""2045180""",no,CAREER: Foundations of Cryptographic Proof Systems,CNS,08/01/2021,2021,VA,University of Virginia Main Campus,10/31/2021,70463.0
"=""2055544""",no,Oscillatory Integrals and Falconer's Conjecture,DMS,08/01/2021,2021,NJ,Princeton University,08/31/2021,179348.0
"=""2115087""",no,CICI: UCSS: Building a Community of Practice for Supporting Regulated Research,OAC,08/01/2021,2021,IN,Purdue University,11/30/2021,499781.0
"=""2055022""",no,"New Approaches to Questions in Sampling, Counting, and Optimization",DMS,07/15/2021,2021,GA,Georgia Tech Research Corporation,10/31/2021,303034.0
"=""2055245""",no,NSF-DFG Echem: Operando Electronic Structure Determination of Iron and its Time-Dependent Dynamics in FexNi100-x(OH)y Electrooxidation Catalysts,CBET,07/15/2021,2021,AR,University of Arkansas,09/30/2021,251372.0
"=""2139189""",no,I-Corps:  Identification of a stable hybrid carrier for large-scale expression of recombinant miRNAs and siRNAs in E. coli,TI,07/15/2021,2021,CA,University of California-Davis,12/31/2021,50000.0
"=""2140040""",no,Network and Distributed System Security Symposium 2021,CNS,07/15/2021,2021,VA,Internet Society,12/31/2021,17518.0
"=""2105445""",no,Probing Near-Symplectic 4-Manifolds and Contact 3-Manifolds with Seiberg-Witten Theory,DMS,07/15/2021,2021,MA,Harvard University,09/30/2021,155206.0
"=""2107035""",no,Collaborative Research: SHF: Medium: Ensuring Safety and Liveness of Modern Systems through Dynamic Temporal Analysis,CCF,07/15/2021,2021,NE,University of Nebraska-Lincoln,11/30/2021,247349.0
"=""2054471""",no,Applications of Model Theory to Functional Transcendence,DMS,07/01/2021,2021,NY,CUNY Bronx Community College,12/31/2021,144760.0
"=""2051644""",no,SBIR Phase I:  Automated Perception for Robotic Chopsticks Manipulating Small and Large Objects in Constrained Spaces,TI,07/01/2021,2021,TN,"DEXTROUS ROBOTICS, INC.",12/31/2021,256000.0
"=""2104995""",no,CRII: RI: Using Linguistic Variation to Understand Deep Neural Models of Language,IIS,07/01/2021,2021,CA,University of California-Santa Barbara,08/31/2021,175000.0
"=""2105548""",no,Subgroups in Artin Groups and Lattices in Products of Trees,DMS,07/01/2021,2021,IL,University of Chicago,12/31/2021,163208.0
"=""2055105""",no,Quantum Subgroups of the Low Rank Lie Algebras,DMS,07/01/2021,2021,TN,Vanderbilt University,07/31/2021,112428.0
"=""2112424""",no,SBIR Phase I:  A transformative low-cost approach for Direct Air Capture of CO2 via repeated cycles of ambient weathering of metal oxides,TI,07/01/2021,2021,CA,"Heirloom Carbon Technologies, Inc.",12/31/2021,255737.0
"=""2055226""",no,Homogenization Methods in Statistical Physics,DMS,07/01/2021,2021,IL,University of Chicago,07/31/2021,313633.0
"=""2105576""",no,Entropy in Mean Curvature Flow and Minimal Hypersurfaces,DMS,07/01/2021,2021,CA,California Institute of Technology,09/30/2021,121016.0
"=""2101508""",no,Practice-Driven Professional Development for Algebra Teachers,DRL,07/01/2021,2021,MO,University of Missouri-Columbia,12/31/2021,1174293.0
"=""2111581""",no,SBIR Phase I:  A novel small-scale wave energy converter for marine equipment or emergency devices,TI,06/15/2021,2021,FL,ENGINEERING TECHNOLOGIES LLC,11/30/2021,165637.0
"=""2129540""",no,I-Corps:  Development of a Periodontal Ultrasound/Photoacoustic Imaging Device,TI,06/01/2021,2021,CA,University of California-San Diego,11/30/2021,50000.0
"=""2126085""",no,I-Corps: Simulation-based Decision Support Platform for Regenerative Medicine Manufacturing and Distribution,TI,06/01/2021,2021,GA,Georgia Tech Research Corporation,11/30/2021,50000.0
"=""2135528""",no,CRREL Engineering and Applied Science Support for Polar Regions,OPP,06/01/2021,2021,MS,Department of Army Cold Regions Research & Engineering Lab,12/01/2021,250000.0
"=""2132729""",no,I-Corps: Software Platform for the Assessment and Measurement of Port Disruptions,TI,06/01/2021,2021,IL,University of Illinois at Urbana-Champaign,11/30/2021,50000.0
"=""2106978""",no,Collaborative Research: CNS Core: Medium: Towards Understanding and Handling Problems Due to Coexistence of Multiple IoT Platforms,CNS,06/01/2021,2021,PA,Temple University,12/31/2021,300000.0
"=""2130872""",no,Emergent Properties of Cancer Square Table,DMS,06/01/2021,2021,NY,Syracuse University,11/30/2021,99036.0
"=""2105773""",no,Collaborative Research: CNS Core: Medium: A Unified Prefetch Framework for Approximation-Tolerant Interactive Applications,CNS,06/01/2021,2021,CA,University of California-Los Angeles,10/31/2021,199999.0
"=""2131820""",no,I-Corps: A home-based kit for monitoring melatonin profile in insomnia patients,TI,05/15/2021,2021,MI,Regents of the University of Michigan - Ann Arbor,10/31/2021,50000.0
"=""2047655""",no,CAREER: AutoEdge: Deep Reinforcement Learning Methods and Systems for Network Automation at Wireless Edge,CNS,05/15/2021,2021,NC,University of North Carolina at Charlotte,11/30/2021,88188.0
"=""2110037""",no,SBIR Phase I:  Physiological Brain Measurement for Anxiety Assessment and Trending,TI,05/15/2021,2021,PA,COGWEAR LLC,12/31/2021,256000.0
"=""2035588""",no,SBIR Phase I:  Improved Catalysts for Sanitizer Ethanol Production (COVID-19),TI,05/15/2021,2021,NY,"AIR COMPANY HOLDINGS, INC.",10/31/2021,256000.0
"=""2121677""",no,NSF Convergence Accelerator Workshop: Coastal Biocultural Restoration as a Nexus for Innovation,OIA,05/15/2021,2021,HI,PURPLE MAI`A FOUNDATION,10/31/2021,99277.0
"=""2044430""",no,CAREER: Scheduling Driving Sensing and Control Nodes in Nonlinear Networks with Applications to Fuel-Free Energy Systems,CMMI,05/01/2021,2021,TX,University of Texas at San Antonio,10/31/2021,526527.0
"=""2122643""",no,NSF Convergence Accelerator Workshop -- Accelerating Translational Materials R&D for Global Challenges,OIA,05/01/2021,2021,NY,IBM Thomas J Watson Research Center,10/31/2021,77000.0
"=""2043706""",no,"DDRIG: From SARS to COVID-19: Nursing, Knowledges, and Trauma",SES,05/01/2021,2021,NY,Cornell University,10/31/2021,12600.0
"=""2039026""",no,"Collaborative Research: CPS: Medium: Wildland Fire Observation, Management, and Evacuation using Intelligent Collaborative Flying and Ground Systems",CNS,05/01/2021,2021,AZ,Northern Arizona University,12/31/2021,649890.0
"=""2042516""",no,CAREER: Developing New Computational Methods to Address the Missing Data Problem in Population Genomics,DBI,05/01/2021,2021,CA,California State University San Marcos Corporation,09/30/2021,484170.0
"=""2101278""",no,"SBIR Phase I:  A Rapid, Sensitive Pathogen Typing and Antibiotic Sensitivity Test for Bloodstream Infections (COVID-19)",TI,05/01/2021,2021,NC,Kepley Biosystems Incorporated,12/31/2021,255834.0
"=""2111704""",no,SBIR Phase I:  Preclinical Validation of an Ocular Antioxidant Enhancing Gene Delivery Vehicle to Target Dry Macular Degeneration,TI,05/01/2021,2021,CA,OCULOGENEX,10/31/2021,256000.0
"=""2102404""",no,Collaborative Research: New Approaches to Narrow-Band Electrochromics,CHE,05/01/2021,2021,GA,Georgia Tech Research Corporation,09/30/2021,360000.0
"=""2123085""",no,"Coastal Sustainability: Clean, Safe, Smart, and Equitable Communities",OIA,05/01/2021,2021,MA,Northeastern University,10/31/2021,99316.0
"=""2036347""",no,STTR Phase I:Dramatically improving algorithm execution on quantum devices through advanced noise-awareness and control,TI,05/01/2021,2021,MA,"ALIRO TECHNOLOGIES, INC.",10/31/2021,255682.0
"=""2045078""",no,CAREER: Designing Quorum Sensing Modulators for Lactobacillus plantarum to Probe Interspecies and Host-Microbe Interactions,CHE,05/01/2021,2021,PA,Moravian University,08/31/2021,290339.0
"=""2032261""",no,Collaborative Research/GOALI: Fully Continuous Downstream Processing Enabled by Coupled Precipitation-Filtration Capture Operations,CBET,04/15/2021,2021,NY,Rensselaer Polytechnic Institute,08/31/2021,70052.0
"=""2126096""",no,RAPID: Texas Winter Storm,SES,04/15/2021,2021,TX,Texas Tech University,09/30/2021,86231.0
"=""2114689""",no,Manipulation and Detection of Physical Properties of Two-Dimensional Quantum Materials,DMR,04/15/2021,2021,PA,Materials Research Society,09/30/2021,10000.0
"=""2124827""",no,I-Corps: A Simulation Tool to Teach Cybersecurity and Digital Fluency,TI,04/01/2021,2021,NY,SUNY CANTON,11/30/2021,50000.0
"=""2051603""",no,SBIR Phase I:  Highly resource-efficient protein engineering using machine learning,TI,04/01/2021,2021,MA,"NABLA BIO, INC.",11/30/2021,256000.0
"=""2121124""",no,GeoConvergence Workshop,ITE,04/01/2021,2021,NY,Fund For the City of New York,07/31/2021,99300.0
"=""2043785""",no,"Aquifers, Science, and Spatial Imaginaries",BCS,04/01/2021,2021,TX,William Marsh Rice University,10/31/2021,455642.0
"=""2128705""",no,CAREER: Optogenetic Analysis of Neurovascular Coupling,CBET,04/01/2021,2021,FL,Florida Atlantic University,08/31/2021,123291.0
"=""2032177""",no,SBIR Phase I:  Regenerable Antimicrobial Paints Based on Hydrogen Peroxide,TI,04/01/2021,2021,FL,"Quick-Med Technologies, In",09/30/2021,255999.0
"=""2118915""",no,Old Dominion University/Synthetic Conducting Cable for Trace Metal-clean Sampling Winch SSSE,OCE,04/01/2021,2021,VA,Old Dominion University Research Foundation,12/31/2021,180320.0
"=""2043614""",no,Doctoral Dissertation Research: Soil Frontiers: Exploring the Culture and Politics of Soil Microbiology Research,SES,04/01/2021,2021,NY,New York University,12/31/2021,15750.0
"=""2128781""",no,Collaborative Research: The Transition from Rifting to Seafloor Spreading at the Western Tip of the Cocos-Nazca Rift,OCE,04/01/2021,2021,CA,University of California-San Diego Scripps Inst of Oceanography,08/31/2021,26093.0
"=""2052113""",no,SBIR Phase I:  Feasibility of Dynamic Configurable Liquid Molding,TI,04/01/2021,2021,KY,"Hummingbird Nano, Inc.",11/30/2021,256000.0
"=""2035423""",no,SBIR Phase I:  Decentralized Internet Access Management System with Post-Quantum Security,TI,04/01/2021,2021,NY,Max Powers,12/31/2021,275886.0
"=""2124834""",no,Workshop on Quantum Engineering Infrastructure. To Be Held Virtual In April 2021.,ECCS,04/01/2021,2021,MN,University of Minnesota-Twin Cities,09/30/2021,18389.0
"=""2049765""",no,Collaborative Research: Honest and Robust Inference with High Dimensional Data,SES,04/01/2021,2021,CT,Yale University,08/31/2021,194000.0
"=""2125017""",no,Kickstarting Advances in Assistive and Rehabilitative Technologies,OIA,04/01/2021,2021,GA,Georgia Tech Research Corporation,09/30/2021,118904.0
"=""2117998""",no,EAGER: Towards DNA-based Tools for Single-particle Cryo-electron Microscopy of Membrane Proteins,MCB,04/01/2021,2021,OH,Kent State University,09/30/2021,86444.0
"=""2120091""",no,Collaborative: Smart Health in the AI and COVID Era,IIS,03/15/2021,2021,AZ,University of Arizona,08/31/2021,30000.0
"=""2131903""",no,TWC: Large: Collaborative: The Science and Applications of Crypto-Currency,CNS,03/15/2021,2021,PA,Carnegie Mellon University,06/30/2021,25592.0
"=""2043832""",no,"Doctoral Dissertation Research: Starting-up with the State: Computing, Entrepreneurship, and Governance",SES,03/15/2021,2021,NY,New York University,10/31/2021,15750.0
"=""2046034""",no,CAREER: Adaptive Communications and Trajectory Design for UAV-assisted Wireless Networks: a Multi-Scale Decision Framework,CNS,03/15/2021,2021,IN,Purdue University,06/30/2021,94125.0
"=""2120516""",no,I-Corps:  An Intelligent Re-Design Recommender System for Additive and Hybrid Manufacturing,TI,03/15/2021,2021,NY,SUNY at Buffalo,08/31/2021,0.0
"=""2120217""",no,Collaborative: Smart Health in the AI and COVID Era,IIS,03/15/2021,2021,AZ,Northern Arizona University,08/31/2021,19927.0
"=""2046538""",no,CAREER: Advancing Network Configuration and Runtime Adaptation Methods for Industrial Wireless Sensor-Actuator Networks,CNS,03/15/2021,2021,NY,SUNY at Binghamton,10/31/2021,98078.0
"=""2044841""",no,"CAREER: Memory-Efficient, Heterogeneity-Aware and Robust Architecture for Federated Intelligence on Edge Devices",CNS,03/01/2021,2021,VA,Old Dominion University Research Foundation,10/31/2021,181584.0
"=""2112895""",no,I-Corps: A reactor (electrolyzer) that converts carbon dioxide to fuels and chemicals using renewable sources of energy,TI,03/01/2021,2021,CA,University of California-San Diego,08/31/2021,50000.0
"=""2036836""",no,SBIR Phase I:  A Novel Respiratory Ventilator for Clinical Care (COVID-19),TI,03/01/2021,2021,VT,SPERRY MEDTECH INC.,08/31/2021,255382.0
"=""2128738""",no,Detail between Naval Postgraduate School and National Science Foundation for Dr. Robert Beverly.(Year 2),OAC,03/01/2021,2021,CA,Naval Postgraduate School,10/01/2021,208641.0
"=""2043918""",no,Identifying & Implementing Evidence-Based Online Tutoring Practices: Online Practices for Tutoring In Mathematics Using Meaningful Interactions,DUE,03/01/2021,2021,WV,West Virginia University Research Corporation,12/31/2021,307040.0
"=""2122039""",no,Election Science: Convergence Accelerator Workshop Proposal,OIA,03/01/2021,2021,MA,Massachusetts Institute of Technology,11/30/2021,95447.0
"=""2034274""",no,"SBIR Phase I:  Empowering Distance Learning for CS/CE Students with Real-time, Personalized Feedback through Anti-Pattern Detection and Correction (COVID-19)",TI,03/01/2021,2021,NJ,"AG350, INC.",11/30/2021,251747.0
"=""2124527""",no,I-Corps: Neurologic assessment tool to identify patients with traumatic brain injury,TI,03/01/2021,2021,MI,Regents of the University of Michigan - Ann Arbor,08/31/2021,50000.0
"=""2035933""",no,SBIR Phase I:  Anatomy Reimagined in an Educational Tool with Gaming and 3D Models,TI,03/01/2021,2021,IL,DISSECT 360 LLC,11/30/2021,256000.0
"=""2119533""",no,"NSF Convergence Accelerator: Sustainable Systems Enabling Food Security in Extreme Environments and Food Deserts employing a Convergence of Food, Energy, Water and Systems",OIA,03/01/2021,2021,TX,University of Texas at El Paso,08/31/2021,93546.0
"=""2138037""",no,Exploring ways to use national datasets to promote broader participation of race-gender groups in STEM,DRL,03/01/2021,2021,MD,Johns Hopkins University,12/31/2021,61853.0
"=""2124720""",no,U.S. Government Printing Office (GPO) – Federal Register,DAS,02/18/2021,2021,DC,Government Printing Office,08/18/2021,100000.0
"=""2043494""",no,SCC-CIVIC-PG Track B Community Resilience Catalyst: Co-Designing an Integrated Participatory Mapping System for Enhancing Disaster Resilience through Community Engagement,CNS,02/15/2021,2021,NY,HISPANIC FEDERATION INC,09/30/2021,50000.0
"=""2043634""",no,SCC-CIVIC-PG Track A: City of Bridges:  Using New Transportation Options to Drive Low-Income Mothers to Greater Success in Pittsburgh,CNS,02/15/2021,2021,PA,Carnegie Mellon University,12/31/2021,49899.0
"=""2043900""",no,SCC-CIVIC-PG Track B: A Visualization Tool and Assessment Framework for Civic Technology Use in the DMV Area: The Case of 311 Systems During the COVID-19 Outbreak,SES,02/15/2021,2021,VA,George Mason University,07/31/2021,49846.0
"=""2035954""",no,SBIR Phase I:  Electrochemically-Mediated Highly Selective SO2 Scrubbing,TI,02/15/2021,2021,MA,"VERDOX, INC.",11/30/2021,250010.0
"=""2044995""",no,SCC-CIVIC-PG Track A: Co-Creating Context-Sensitive Mobility Strategies for Advancing the Social and Economic Goals of Low-Income Communities,CNS,02/15/2021,2021,MA,"E4THEFUTURE, INC.",07/31/2021,49932.0
"=""2038076""",no,SaTC: CORE: Small: Leveraging Physical Side-Channel Information to Build Detection-Based Rowhammer Defenses,CNS,02/15/2021,2021,TX,Texas Tech University,10/31/2021,200000.0
"=""2047236""",no,SCC-CIVIC-PG Track A - The Lily Pad Neighborhood Mobility Hub Planning and Feasibility Study,CNS,02/15/2021,2021,NY,CUNY New York City College of Technology,10/31/2021,50000.0
"=""2040488""",no,SCC-CIVIC-PG Track B: An Integrated Scenario-based Hurricane Evacuation Management Tool to Support Community Preparedness,CNS,02/15/2021,2021,DE,University of Delaware,12/31/2021,50000.0
"=""2052219""",no,SBIR Phase I:  Development of an ovulation biosensor,TI,02/15/2021,2021,CO,"MFB FERTILITY, INC.",12/31/2021,256000.0
"=""2036072""",no,SBIR Phase I:  DEEP-MOP - Development of an Electrification Enabling Platform for Maritime Outboard Propulsion,TI,02/15/2021,2021,RI,FLUX MARINE LTD,10/31/2021,255684.0
"=""2051962""",no,"SBIR Phase I:  A novel, microfluidic device to improve collection and analysis of biopsy samples from ocular paracentesis",TI,02/15/2021,2021,PA,"VISIONAIRE PRODUCTS, INC",07/31/2021,256000.0
"=""2043863""",no,SCC-CIVIC-PG Track B: Hyperlocal Services to Prepare Rural Communities for Extreme Weather-Related Natural Disasters,CNS,02/15/2021,2021,NY,Cornell University,07/31/2021,50000.0
"=""2042836""",no,SCC-CIVIC-PG Track B Creating an Integrated Emergency and Crisis Response System,CNS,02/15/2021,2021,MN,University of Minnesota-Twin Cities,07/31/2021,50000.0
"=""2123276""",no,UNS:   Low Latency Video Rate Hyperspectral Imaging and Analysis for In Vivo Imaging,CBET,02/15/2021,2021,CA,NUMENTUS TECHNOLOGIES INC.,09/30/2021,47172.0
"=""2048906""",no,Symbolic Computation Meets Computational Geometry and Data Approximation,DMS,02/15/2021,2021,AL,Auburn University,12/31/2021,86476.0
"=""2110076""",no,I-Corps:  Bridging the Supply Chain Information Gap Using Micro-Logistics Internet of Things (IoT),TI,02/15/2021,2021,MA,Massachusetts Institute of Technology,07/31/2021,50000.0
"=""2121725""",no,Collaborative Research: Bidirectional Effects Between Parental Work-Family Conflict and Adolescent Psychosocial Adjustment,SES,02/15/2021,2021,FL,Florida State University,11/30/2021,4402.0
"=""2030644""",no,SBIR Phase I:  Facilitating Early Childhood Teacher and Family Engagement During COVID-19,TI,02/15/2021,2021,NY,Cognitive ToyBox,07/31/2021,256000.0
"=""2044098""",no,SCC-CIVIC-PG Track B: Knowledge-to-Action: Enhance Community Disaster Preparedness and Resiliency through Physical and Virtual Drills,CNS,02/15/2021,2021,OR,Oregon State University,07/31/2021,50000.0
"=""2115300""",no,Collaborative Research: National Symposium on PRedicting Emergence of Virulent Entities by Novel Technologies (PREVENT),CCF,02/01/2021,2021,MI,Regents of the University of Michigan - Ann Arbor,09/30/2021,11378.0
"=""2115122""",no,Collaborative Research: National Symposium on PRedicting Emergence of Virulent Entities by Novel Technologies (PREVENT),CCF,02/01/2021,2021,NY,New York University,09/30/2021,26422.0
"=""2113755""",no,Collaborative Research: The Making of Engineers: Influence of Makerspaces on the Preparation of Undergraduates as Engineers,EEC,02/01/2021,2021,FL,University of Florida,06/30/2021,32404.0
"=""2115126""",no,Collaborative Research: National Symposium on PRedicting Emergence of Virulent Entities by Novel Technologies (PREVENT),CCF,02/01/2021,2021,GA,Georgia Tech Research Corporation,09/30/2021,66071.0
"=""2110337""",no,Virtual Sequential Labs for Selection of the Next OOI Pioneer Array Location,OCE,02/01/2021,2021,RI,University of Rhode Island,10/31/2021,236079.0
"=""2044061""",no,SCC-CIVIC-PG Track B: A tourism decision support system for Western gateway and natural amenity region communities,CNS,02/01/2021,2021,UT,Utah State University,07/31/2021,49954.0
"=""2105866""",no,"I-Corps:  Layered Multi-functional Building Panel for Energy Efficient, Affordable Housing",TI,02/01/2021,2021,MN,University of Minnesota Duluth,12/31/2021,50000.0
"=""2014230""",no,SBIR Phase I:  Autonomous and permanently deployed ship hull inspection and cleaning vehicle,TI,02/01/2021,2021,CA,O-Robotix Inc,07/31/2021,225000.0
"=""2035620""",no,SBIR Phase I:  Experimental validation of an innovative lift-generating mechanism for use in future VTOL Aircraft.,TI,02/01/2021,2021,NC,"NOVO AERO TECHNOLOGY, INC.",12/31/2021,230311.0
"=""2128611""",no,Advancing Fractional Combinatorial Optimization: Computation and Applications,DMS,02/01/2021,2021,CA,University of Southern California,09/30/2021,122773.0
"=""2049875""",no,I-Corps: Low-Cost Holographic TelePresence System,TI,02/01/2021,2021,NC,University of North Carolina at Charlotte,12/31/2021,50000.0
